company,date,section,text
CRWD,2023-03-09,risk factors,"effectively attract, integrate, and retain a large number of new employees, particularly members of our sales and marketing and research and development teams; further improve our falcon platform, including our cloud modules, and it infrastructure, including expanding and optimizing our data centers, to support our business needs; enhance our information and communication systems to ensure that our employees and offices around the world are well coordinated and can effectively communicate with each other and our growing base of channel partners and customers; and improve our financial, management, and compliance systems and controls. if we fail to achieve these objectives effectively, our ability to manage our expected growth, ensure uninterrupted operation of our falcon platform and key business systems, and comply with the rules and regulations applicable to our business could be impaired. additionally, the quality of our platform and services could suffer and we may not be able to adequately address competitive challenges. any of the foregoing could adversely affect our business, results of operations, and financial condition. we have a history of losses and may not be able to achieve or sustain profitability in the future. we have incurred net losses in all periods since our inception, and we may not achieve or maintain profitability in the future. we experienced net losses of $183.2 million, $234.8 million, and $92.6 million for fiscal 2023, fiscal 2022, and fiscal 2021, respectively. as of january 31, 2023, we had an accumulated deficit of $1.1 billion. while we have experienced significant growth in revenue in recent periods, we cannot assure you when or whether we will reach or maintain profitability. we also expect our operating expenses to increase in the future as we continue to invest for our future growth, which will negatively affect our results of operations if our total revenue does not increase. we cannot assure you that these investments will result in substantial increases in our total revenue or improvements in our results of operations. we also have incurred and expect to continue to incur significant additional legal, accounting, and other expenses as a public company. any failure to increase our revenue as we invest in our business or to manage our costs could prevent us from achieving or maintaining profitability or positive cash flow. if organizations do not adopt cloud-based saas-delivered endpoint security solutions, our ability to grow our business and results of operations may be adversely affected. we believe our future success will depend in large part on the growth, if any, in the market for cloud-based saas-delivered endpoint security solutions. the use of saas solutions to manage and automate security and it operations is at an early stage and rapidly evolving. as such, it is difficult to predict its potential growth, if any, customer adoption and retention rates, customer demand for our solutions, customer consolidation on our platform, or the success of existing competitive products. any expansion in our market depends on a number of factors, including the cost, performance, and perceived value associated with our solutions and those of our competitors. if our solutions do not achieve widespread adoption or there is a reduction in demand for our solutions due to a lack of customer acceptance, technological challenges, competing products, privacy concerns, decreases in corporate spending, weakening economic conditions or otherwise, it could result in early terminations, reduced customer retention rates, or decreased revenue, any of which would adversely affect our business, results of operations, and financial results. we do not know whether the trend in adoption of cloud-based saas-delivered endpoint security solutions we have experienced in the past will continue in the future. furthermore, if we or other saas security providers experience security incidents, loss or disclosure of customer data, disruptions in delivery, or other problems, the market for saas solutions as a"
CRWD,2023-03-09,risk factors,"whole, including our security solutions, could be negatively affected. you should consider our business and prospects in light of the risks and difficulties we encounter in this new and evolving market. if we are unable to successfully enhance our existing products and services and introduce new products and services in response to rapid technological changes and market developments as well as evolving security threats, our competitive position and prospects will be harmed. our ability to increase revenue from existing customers and attract new customers will depend in significant part on our ability to anticipate and respond effectively to rapid technological changes and market developments as well as evolving security threats. the success of our falcon platform depends on our ability to take such changes into account and invest effectively in our research and development organization to increase the reliability, availability and scalability of our existing solutions and introduce new solutions. if we fail to effectively anticipate, identify or respond to such changes in a timely manner, or at all, our business could be harmed. even if we adequately fund our research and development efforts there is no guarantee that we will realize a return on such efforts. success in delivering enhancements and new solutions depends on several factors, including the timely completion, introduction and market acceptance of the enhancement or new solution, the risk that such enhancement or new solution may have quality or other defects or deficiencies, especially in the early stages of introduction, as well as our ability to seamlessly integrate all of our product and service offerings and develop adequate sales capabilities in new markets. failure in this regard may erode our competitive position, significantly impair our revenue growth, and negatively impact our operating results."
CRWD,2023-03-09,risk factors,"if we are unable to attract new customers, our future results of operations could be harmed. to expand our customer base, we need to convince potential customers to allocate a portion of their discretionary budgets to purchase our falcon platform. our sales efforts often involve educating our prospective customers about the uses and benefits of our falcon platform. enterprises and governments that use legacy security products, such as signature-based or malware-based products, firewalls, intrusion prevention systems, and antivirus, for their it security may be hesitant to purchase our falcon platform if they believe that these products are more cost effective, provide substantially the same functionality as our falcon platform or provide a level of it security that is sufficient to meet their needs. we may have difficulty convincing prospective customers of the value of adopting our solution. even if we are successful in convincing prospective customers that a cloud native platform like ours is critical to protect against cyberattacks, they may not decide to purchase our falcon platform for a variety of reasons, some of which are out of our control. for example, any deterioration in general economic conditions, including as a result of the geopolitical environment, the outbreak of diseases such as covid-19 or inflation (as well as government policies such as raising interest rates in response to inflation), have in the past and may in the future cause our current and prospective customers to delay or cut their overall security and it operations spending, and such delays or cuts may fall disproportionately on cloud-based security solutions like ours. economic weakness, customer financial difficulties, and constrained spending on security and it operations may result in decreased revenue, reduced sales, an increase in multi-phase subscription start dates, shorter terms for customer subscriptions, lengthened sales cycles, increased churn, lower demand for our products, and adversely affect our results of operations and financial conditions. furthermore, we may need to exercise more flexibility in customer payment terms as customers navigate a more challenging economic environment. additionally, if the incidence of cyberattacks were to decline, or be perceived to decline, or if organizations adopt endpoints that use operating systems we do not adequately support, our ability to attract new customers and expand sales of our solutions to existing customers could be adversely affected. if organizations do not continue to adopt our falcon platform, our sales will not grow as quickly as anticipated, or at all, and our business, results of operations, and financial condition would be harmed. if our customers do not renew their subscriptions for our products and add additional cloud modules to their subscriptions, our future results of operations could be harmed. in order for us to maintain or improve our results of operations, it is important that our customers renew their subscriptions for our falcon platform when existing contract terms expire, and that we expand our commercial relationships with our existing customers by selling additional cloud modules and by deploying to more endpoints in their environments. our customers have no obligation to renew their subscription for our falcon platform after the expiration of their contractual subscription period, which is generally one year, and in the normal course of business, some customers have elected not to renew. in addition, customers that previously signed multi-year subscription contracts may renew for shorter contract subscription lengths, and customers may cease using certain cloud modules altogether. even if customers choose to renew their subscription of certain cloud modules, they may decline to purchase additional cloud modules or choose not to consolidate onto our falcon platform."
CRWD,2023-03-09,risk factors,"our customer retention and expansion may decline or fluctuate as a result of a number of factors, including our customers’ satisfaction with our services, our pricing, customer security and networking issues and requirements, our customers’ spending levels, decreases in the number of endpoints to which our customers deploy our solutions, mergers and acquisitions involving our customers, industry developments, competition and general economic and geopolitical conditions. if our efforts to maintain and expand our relationships with our existing customers are not successful, our business, results of operations, and financial condition may materially suffer."
CRWD,2023-03-09,risk factors,"our sales cycles can be long and unpredictable, and our sales efforts require considerable time and expense. our revenue recognition is difficult to predict because of the length and unpredictability of the sales cycle for our falcon platform. customers often view the subscription to our falcon platform as a significant strategic decision and, as a result, frequently require considerable time to evaluate, test and qualify our falcon platform prior to entering into or expanding a relationship with us. large enterprises and government entities in particular often undertake a significant evaluation process that further lengthens and adds uncertainty to our sales cycle. in addition, uncertain economic conditions may lead to additional scrutiny of budgets by current and prospective customers, which has resulted in, for example, longer sales cycles for products and services, and may result in shifting demand for it products and services, and slower adoption of new technologies. our direct sales team develops relationships with our customers, and works with our channel partners on account penetration, account coordination, sales and overall market development. we spend substantial time and resources on our sales efforts without any assurance that our efforts will produce a sale. security solution purchases are frequently subject to budget constraints, multiple approvals and unanticipated administrative, processing and other delays. as a result, it is difficult to predict whether and when a sale will be completed. the failure of our efforts to secure sales after investing resources in a lengthy sales process could adversely affect our business and results of operations. we face intense competition and could lose market share to our competitors, which could adversely affect our business, financial condition, and results of operations. the market for security and it operations solutions is intensely competitive, fragmented, and characterized by rapid changes in technology, customer requirements, industry standards, increasingly sophisticated attackers, and by frequent introductions of new or improved products to combat security threats. we expect to continue to face intense competition from current competitors, as well as from new entrants into the market. if we are unable to anticipate or react to these challenges, our competitive position could weaken, and we could experience a decline in revenue or reduced revenue growth, and loss of market share that would adversely affect our business, financial condition, and results of operations. our ability to compete effectively depends upon numerous factors, many of which are beyond our control, including, but not limited to: product capabilities, including performance and reliability, of our falcon platform, including our cloud modules, services, and features compared to those of our competitors; our ability, and the ability of our competitors, to improve existing products, services, and features, or to develop new ones to address evolving customer needs; our ability to attract, retain, and motivate talented employees; our ability to establish and maintain relationships with channel partners; the strength of our sales and marketing efforts; and acquisitions or consolidation within our industry, which may result in more formidable competitors. our competitors include the following by general category: legacy antivirus product providers who offer a broad range of approaches and solutions including traditional signature-based anti-virus protection; alternative endpoint security providers who generally offer a mix of on-premise and cloud-hosted products that rely heavily on malware-only or application whitelisting techniques;"
CRWD,2023-03-09,risk factors,"network security vendors who are supplementing their core perimeter-based offerings with endpoint security solutions; and professional service providers who offer cybersecurity response services. many of our competitors have greater financial, technical, marketing, sales, and other resources, greater name recognition, longer operating histories, and a larger base of customers than we do. they may be able to devote greater resources to the development, promotion, and sale of services than we can, and they may offer lower pricing than we do. further, they may have greater resources for research and development of new technologies, the provision of customer support, and the pursuit of acquisitions. our larger competitors have substantially broader and more diverse product and services offerings as well as routes to market, which allows them to leverage their relationships based on other products or incorporate functionality into existing products to gain business in a manner that discourages users from purchasing our platform, including our cloud modules. conditions in our market could change rapidly and significantly as a result of technological advancements, partnering or acquisitions by our competitors or continuing market consolidation. some of our competitors have recently made acquisitions of businesses or have established cooperative relationships that may allow them to offer more directly competitive and comprehensive solutions than were previously offered and adapt more quickly to new technologies and customer needs. these competitive pressures in our market or our failure to compete effectively may result in price reductions, fewer orders, reduced revenue and gross margins, increased net losses and loss of market share. further, competitors that specialize in providing protection from a single type of security threat may be able to deliver these targeted security products to the market quicker than we can or convince organizations that these limited products meet their needs. even if there is significant demand for cloud-based security solutions like ours, if our competitors include functionality that is, or is perceived to be, equivalent to or better than ours in legacy products that are already generally accepted as necessary components of an organization’s it security architecture, we may have difficulty increasing the market penetration of our platform. furthermore, even if the functionality offered by other security and it operations providers is more limited than the functionality of our platform, organizations may elect to accept such limited functionality in lieu of adding products from additional vendors like us. if we are unable to compete successfully, or if competing successfully requires us to take aggressive pricing or other actions, our business, financial condition, and results of operations would be adversely affected."
CRWD,2023-03-09,risk factors,"competitive pricing pressure may reduce our gross profits and adversely affect our financial results. if we are unable to maintain our pricing due to competitive pressures or other factors, our margins will be reduced and our gross profits, business, results of operations, and financial condition would be adversely affected. the subscription prices for our falcon platform, cloud modules, and professional services may decline for a variety of reasons, including competitive pricing pressures, discounts, anticipation of the introduction of new solutions by our competitors, or promotional programs offered by us or our competitors. the cybersecurity market remains very competitive, and competition may further increase in the future. competitors may reduce the price of products or subscriptions that compete with ours or may bundle them with other products and subscriptions. if our solutions fail or are perceived to fail to detect or prevent incidents or have or are perceived to have defects, errors, or vulnerabilities, our brand and reputation would be harmed, which would adversely affect our business and results of operations. real or perceived defects, errors or vulnerabilities in our falcon platform and cloud modules, the failure of our platform to detect or prevent incidents, including advanced and newly developed attacks, misconfiguration of our solutions, or the failure of customers to take action on attacks identified by our platform could harm our reputation and adversely affect our business, financial position and results of operations. because our cloud native security platform is complex, it may contain defects or errors that are not detected until after deployment. we cannot assure you that our products will detect all cyberattacks, especially in light of the rapidly changing security threat landscape that our solution seeks to address. due to a variety of both internal and external factors, including, without limitation, defects or misconfigurations of our solutions, our solutions could be or become vulnerable to security incidents (both from intentional attacks and accidental causes) that cause them to fail to secure endpoints and detect and block attacks. in addition, because the techniques used by computer hackers to access or sabotage networks and endpoints change frequently and generally are not recognized until launched against a target, there is a risk that an advanced attack could emerge that our cloud native security platform is unable to detect or prevent until after some of our customers are affected. additionally, our falcon platform may falsely indicate a cyberattack or threat that does not actually exist, which may lessen customers’ trust in our solutions."
