company,date,section,text
S,2024-03-27,risk factors,"item 1a. risk factors investing in our class a common stock involves a high degree of risk. you should carefully consider the risks and uncertainties described below, together with all of the other information in this annual report on form 10-k, including the section titled “management’s discussion and analysis of financial condition and results of operations,” and our consolidated financial statements and the accompanying notes included before making a decision to invest in our class a common stock. our business, financial condition, operating results, or prospects could also be adversely affected by risks and uncertainties that are not presently known to us or that we currently believe are not material. if any of the risks actually occur, our business, financial condition, operating results, and prospects could be adversely affected. in that event, the market price of our class a common stock could decline, and you could lose all or part of your investment. summary risk factors our business is subject to numerous risks and uncertainties, including those risks more fully described below. these risks include, among others, the following, which we consider our most material risks: risks related to our business and industry we have a limited operating history, which makes it difficult to evaluate our current business and future prospects and increases the risks associated with your investment. we have a history of losses, anticipate increases in our operating expenses in the future, and may not achieve or sustain profitability. if we cannot achieve and sustain profitability, our business, operating results, and financial condition will be adversely affected."
S,2024-03-27,risk factors,"we face intense competition and could lose market share to our competitors, which would adversely affect our business, operating results, and financial condition. our operating results may fluctuate significantly, which could make our future results difficult to predict and could cause our operating results to fall below expectations. adverse global macroeconomic conditions or reduced information technology spending could adversely affect our business, operating results, and financial condition. a network or data security incident against us, whether actual, alleged, or perceived, would harm our reputation, create liability, and regulatory exposure, and adversely affect our business, operating results, and financial condition. defects, errors, or vulnerabilities in our platform, the failure of our platform to block malware or prevent a security breach, misuse of our platform, or risks of product liability claims would harm our reputation and adversely affect our business, operating results, and financial condition. existing and future acquisitions, strategic investments, partnerships, or alliances could be difficult to identify and integrate, divert the attention of key management personnel, disrupt our business, dilute stockholder value and adversely affect our business, operating results, and financial condition. if we are unable to retain our customers, renew and expand our relationships with them, and add new customers, we may not be able to sustain revenue growth, and we may not achieve or maintain profitability in the future. if our platform is not effectively interoperated within our customers’ it infrastructure, deployments could be delayed or canceled, which would adversely affect our business, operating results, and financial condition. disruptions or other business interruptions that affect the availability of our platform could adversely affect our customer relationships and overall business. we may not be able to timely and cost-effectively scale and adapt our existing technology to meet our customers’ performance and other requirements. if we are unable to maintain successful relationships with our channel partners and alliance partners, or if our channel partners or alliance partners fail to perform, our ability to market, sell and distribute our platform will be limited, and our business, operating results, and financial condition will be harmed."
S,2024-03-27,risk factors,"risks related to regulatory matters if we fail to adequately protect personal information or other information we collect, process, share, or maintain under applicable laws, our business, operating results, and financial condition could be adversely affected. risks related to our people we rely on our management team and other key employees and will need additional personnel to grow our business, and the loss of one or more key employees or our inability to hire, integrate, train, manage, retain, and motivate qualified personnel, including members of our board of directors, could harm our business. risks related to our intellectual property our proprietary rights may be difficult to enforce, which could enable others to copy or use aspects of our platform without compensating us. third parties have claimed and may claim in the future that our platform infringes their intellectual property rights, and this may create liability for us or otherwise adversely affect our business, operating results, and financial condition. risks related to ownership of our class a common stock the market price of our class a common stock may be volatile, and you could lose all or part of your investment. the dual class structure of our common stock has the effect of concentrating voting control with certain stockholders who held our capital stock prior to the completion of our ipo, including our directors, executive officers, and other beneficial owners who hold in the aggregate approximately 72% of the voting power of our capital stock, which will limit or preclude your ability to influence corporate matters, including the election of directors and the approval of any change of control transaction. risks related to our business and industry we have a limited operating history, which makes it difficult to evaluate our current business and future prospects and increases the risks associated with your investment. we were founded in january 2013 and released our first endpoint security solution in february 2015. our limited operating history and financial data may make it difficult to evaluate our current business, future prospects and other trends. we have encountered, and will continue to encounter, risks and uncertainties frequently experienced by growing companies in rapidly changing industries and sectors, such as the risks and uncertainties described herein. any predictions about our future revenue and expenses may not be as accurate as they would be if we had a longer operating history or operated in a more predictable or established market. if our assumptions regarding these risks and uncertainties are incorrect or change due to fluctuations in our markets or otherwise, or if we do not address these risks successfully, our operating and financial results could differ materially from our expectations, and our business and operating results would be adversely affected. we cannot assure you that we will be successful in addressing these and other challenges we may face in the future. the risks associated with having a limited operating history may be exacerbated by current global macroeconomic conditions. we have a history of losses, anticipate increases in our operating expenses in the future, and may not achieve or sustain profitability. if we cannot achieve and sustain profitability, our business, operating results, and financial condition will be adversely affected. we have incurred net losses in all periods since our inception, and we may not achieve or maintain profitability in the future. we experienced a net loss of $338.7 million and $378.7 million for the fiscal years ended january 31, 2024 and 2023, respectively. as of january 31, 2024, we had an accumulated deficit of $1.3 billion. while we have historically experienced significant growth in revenue, we cannot predict when or whether we will reach or maintain profitability. we also expect our operating expenses to increase in the future as we continue to invest for our future growth, including expanding our research and development function to drive further development of our platform, expanding our sales and marketing activities, developing the functionality to expand into adjacent markets, and reaching customers in new geographic locations, which will negatively affect our operating results if our total revenue does not increase. in addition to the anticipated costs to grow our business, we have incurred and expect to continue to incur significant additional legal, accounting, and other expenses as a public company, particularly now that we are no longer an emerging growth company. our revenue growth is expected to slow as we grow and our revenue may decline for a number of other reasons, including reduced demand for our platform, increased competition, a decrease in the growth or reduction in size of our overall market, or if we cannot capitalize on growth opportunities, including acquisitions, new products, services, and feature releases. while we consistently evaluate opportunities to reduce our operating costs and optimize efficiencies, including, for example, our restructuring plan in june 2023, we cannot guarantee that these efforts will be successful or that we will not re-accelerate operating expenditures in the future in order to capitalize on growth opportunities. if we fail to increase our revenue to offset increases in our operating expenses or manage our costs as we invest in our business, we may not achieve or sustain profitability."
