ticker,chunked_mgmt_discussion
HUBS,item 7. management’s discussion and analysis of financial condition and results of operations
HUBS,"the following discussion and analysis of our financial condition and results of operations should be read in conjunction with our consolidated financial statements and related notes that appear elsewhere in this annual report on form 10-k. as discussed in the section titled “special note regarding forward-looking statements,” the following discussion and analysis contains forward-looking statements that involve risks and uncertainties, as well as assumptions that, if they never materialize or prove incorrect, could cause our results to differ materially from those expressed or implied by such forward-looking statements. factors that could cause or contribute to such differences include, but are not limited to, those identified below, and those discussed in the section titled “risk factors” included under part i, item 1a within this annual report on form 10-k."
HUBS,"company overview we provide a customer platform that helps businesses connect and grow better. we deliver seamless connection for customer-facing teams with a unified platform that includes three layers: ai-powered engagement hubs, a smart crm, and a connected ecosystem that extends the customer platform with app marketplace integrations, a community network, and educational content."
HUBS,"our engagement hubs include marketing hub, sales hub, service hub, operations hub, cms hub and commerce hub, as well as other tools and integrations that enable companies to attract, engage, and delight customers throughout the customer experience. our customer platform features a central database of lead and customer interactions and integrated applications designed to help businesses attract visitors to their websites, convert visitors into leads, close leads into customers, transact with those customers, and delight them so they become promoters of those businesses. the core of our customer platform is our smart crm: a single database of lead and customer information that allows businesses to track their interactions with contacts and customers, manage their customer activities, and report on their pipeline and sales. our customer platform was built to easily and seamlessly integrate third party applications to further customize to an individual company’s industry or needs. as data is becoming more important to our customers’ success and a differentiator for our business, there is a need to move quickly on data enrichment. the acquisition of clearbit will allow us to build enriched b2b records directly into our customer platform. we designed and built our customer platform to serve a broad range of customers globally. our customer platform starts completely free and grows with our customers to meet their needs at different stages in their life-cycles. it supports multiple languages and currencies and offers an array of sophisticated features, including content partitioning at the enterprise level for companies operating in or serving multiple countries. we focus on selling to mid-market business-to-business, or b2b, companies, which we define as companies that have between two and 2,000 employees. while our customer platform was built to grow with any company, we focus on selling to mid-market businesses because we believe we have significant competitive advantages attracting and serving this market segment. these mid-market businesses seek an integrated, easy-to-implement and easy-to-use solution to reach customers and compete with organizations that have larger marketing, sales, and customer service budgets. we efficiently reach these businesses at scale through our proven inbound methodology, our solutions partners, and our “freemium” model. a solutions partner is a service provider that helps businesses with strategy, execution, and implementation of go-to-market activities and technology solutions. our freemium model attracts customers who begin using our customer platform through our free products and then upgrade to our paid products. as of december 31, 2023, we had 7,663 full-time employees and 205,091 customers of varying sizes in more than 135 countries, representing many industries. our customer platform is a multi-tenant, globally available software-as-a-service product delivered through apis, web browsers or mobile applications. we sell our customer platform on a subscription basis. our total revenue increased to $2.2 billion in 2023, from $1.7 billion in 2022, and from $1.3 billion in 2021, representing year-over-year increases of 25% in 2023 and 33% in 2022. we had net losses of $176.3 million in 2023, $112.7 million in 2022, and $77.8 million in 2021. we derive most of our revenue from subscriptions to our cloud-based customer platform and related professional services, which consist of customer on-boarding, training and consulting services. subscription revenue accounted for 98% of our total revenue for the years ended december 31, 2023 and 2022, and 97% of our total revenue for the year ended december 31, 2021. we sell multiple product plans at different base prices on a subscription basis, each of which includes our smart crm and integrated applications to meet the needs of the various customers we serve. customers pay additional fees if the number of contacts stored and tracked in the customer’s database exceeds specified thresholds. we also generate additional revenue based on the purchase of additional subscriptions and products, and the number of account users and subdomains. most of our customers’ subscriptions are one year or less in duration. subscriptions are billed in advance on various schedules. because the mix of billing terms for orders can vary from period to period, the annualized value of the orders we enter into with our customers will not be completely reflected in deferred revenue at any single point in time. accordingly, we do not believe that change in deferred revenue is an accurate indicator of future revenue. many of our customers purchase on-boarding, training, and consulting services, as well as other tools, which are designed to help customers enhance their ability to attract, engage and delight their customers using our customer platform. we also generate revenue from commerce hub and a number of revenue-share agreements with other companies based on mutually agreed upon terms. professional services and other revenue accounted for 2% of total revenue for the years ended december 31, 2023 and 2022, and 3% of total revenue for the year ended december 31, 2021. we have focused on rapidly growing our business and plan to continue to make investments to help us address some of the challenges facing us to support this growth, such as demand for our customer platform by existing and new customers, significant competition from other providers of marketing, sales, customer service, operations, commerce, and content management software and related applications and rapid technological change in our industry. we believe that the growth of our business is dependent on many factors, including our ability to expand our customer base, increase adoption of our customer platform within existing customers, develop new products and applications to extend the functionality of our customer platform and provide a high level of customer service. we have invested and intend to continue investing for long-term growth. we intend to continue to invest in sales and marketing to support our growth. we plan to continue to invest in research and development as we continue to introduce new products and applications to extend the functionality of our customer platform. we intend to continue maintaining a high level of customer service and support which we consider critical for our continued success. we also plan to continue investing in our data center infrastructure and services capabilities in order to support continued future customer growth. we also expect to continue to incur additional general and administrative expenses as a result of both our growth and the infrastructure required to be a public company. we expect to use our cash flow from operations and the proceeds from our convertible debt to fund these growth strategies and support our business."
HUBS,"global economic conditions our results of operations may be significantly influenced by general macroeconomic conditions, including, but not limited to, the impact of pandemics (such as the covid-19 pandemic), geo-political conflicts, foreign currency fluctuations, interest rates, inflation, recession risks, existing and new domestic and foreign laws and regulations, all of which are beyond our control. fluctuations in foreign exchange rates and rising inflation have had, and may continue to have an adverse impact on our financial condition and operating results in future periods. as we continue to monitor the direct and indirect impacts of these circumstances, the broader implications of these macroeconomic events on our business, results of operations and overall financial position, particularly in the long term, remain uncertain. see part i, item 1a. ""risk factors"" for further discussion of the impact and possible future impacts of pandemics, geo-politcal conflicts, and other general macroeconomic impacts on our business."
HUBS,"key business metrics the following key business metrics are presented in this annual report on form 10-k or in our press releases announcing our financial results which are furnished on form 8-k. we use these key business metrics to evaluate our business, measure our performance, identify trends affecting our business and results of operations, formulate financial projections and make strategic decisions. these key business metrics may be calculated in a manner different than similar key business metrics used by other companies."
HUBS,"year ended december 31, 2023 2022 2021 customers 205,091 167,386 135,442 average subscription revenue per customer $11,384 $11,163 $10,486 net revenue retention 103.9 % 110.3 % 115.2 %"
HUBS,"customers. we believe that our ability to increase our customer base is an indicator of our market penetration, the growth of our business, and our potential future business opportunities as we continue to expand our sales force and invest in marketing efforts. we define our customers at the end of a particular period as the number of business entities with one or more paid subscriptions to our customer platform either purchased directly with us or purchased from a solutions partner. we do not include in customers any legacy piesync or clearbit products. a single customer may have separate paid subscriptions to our customer platform, but we count these as one customer if certain customer-provided information such as company name, url, or email address indicate that these subscriptions are managed by the same business entity. average subscription revenue per customer. we believe that our ability to increase the average subscription revenue per customer is an indicator of our ability to grow the long-term value of our existing customer relationships. we define average subscription revenue per customer during a particular period as subscription revenue, excluding revenue from our legacy piesync and clearbit products, from our customers during the period divided by the average customers during the same period. net revenue retention. we believe that our ability to retain and expand a customer relationship is an indicator of the stability of our revenue base and the long-term value of our customers. net revenue retention is a measure of the percentage of recurring revenue retained from customers over a given period of time. our net revenue retention for a given period is calculated by first dividing retained subscription revenue by retention base revenue in the given period, calculating the weighted average of these rates using the retention base revenue for the period, and then annualizing the resulting rates. a definition of each of the key terms used to calculate net revenue retention is included below. retained subscription revenue. contractual monthly subscription revenue of the same cohort of customers as those that comprise the retention base revenue at the end of the same month. retention base revenue. contractual monthly subscription revenue of our customers as of the beginning of each month. contractual monthly subscription revenue. the subscription fees contractually committed to be paid for a full month under our customer agreements, converted into usd at fixed rates that are held consistent over time, excluding commissions owed to our solutions partners."
HUBS,key components of consolidated statements of operations
HUBS,"revenue we derive our revenue from two major sources, revenue from subscriptions to our customer platform and professional services and other revenue consisting mainly of on-boarding, training, and consulting services fees."
HUBS,"subscription based revenue is derived from customers using our customer platform for their inbound marketing, sales, service, operations, and content management needs. our customer platform includes a system of engagement for efficiently engaging customers through seo, web content, social, blogging, email, marketing automation, messaging, support ticketing, knowledge base, commerce, conversation routing, video hosting, and data enrichment. over 1,500 integrations and applications are available for our users, across a wide range of categories, including integrations with leading social media, email, sales, video, analytics, content and webinar tools. all subscription fees that are billed in advance of service are recorded in deferred revenue. subscription based revenue is recognized net of consideration paid to solutions partners when those solutions partners purchase a subscription to our customer platform. professional services and other revenue are derived primarily from customer on-boarding, training, and consulting services. depending on which hubs and services a customer purchases, they receive on-boarding guidance or one-on-one training from one of our on-boarding, inbound consultants, or technical consultants by web meetings. training is generally sold in connection with a customer’s initial subscription and is billed in advance. the training is also available to be purchased separately following a customer’s purchase of its initial subscription and our solutions partners routinely provide the same training to customers. we also derive revenue from commerce hub and a number of revenue-share agreements with other companies based on mutually agreed upon terms."
HUBS,"cost of revenue, operating and other expenses"
HUBS,"cost of revenue cost of subscription revenue consists primarily of managed hosting providers and other third-party service providers, employee-related costs including payroll, benefits and stock-based compensation expense for our customer support team, amortization of capitalized software development costs and acquired technology, and allocated overhead costs, which we define as facilities, depreciation of fixed assets, and costs related to information technology. cost of professional services and other revenue consists primarily of personnel costs of our professional services organization, including salaries, benefits, bonuses and stock-based compensation, amortization of capitalized software development costs associated with our internally built software platform, as well as professional fees and allocated overhead costs, which we define as facilities, depreciation of fixed assets, and costs related to information technology."
HUBS,"we expect that the cost of subscription and professional services and other revenue will increase in absolute dollars as we continue to invest in growing our business. over time, we expect to gain benefits of scale associated with our costs of hosting our customer platform relative to subscription revenues, resulting in improved subscription gross margin, exclusive of stock-based compensation. we expect professional services and other margins to breakeven for the foreseeable future, exclusive of stock-based compensation."
HUBS,"research and development research and development expenses consist primarily of personnel costs of our development team, including payroll, benefits and stock-based compensation expense, professional and contractor fees and allocated overhead costs. we capitalize certain software development costs that are attributable to developing new products and adding incremental functionality to our customer platform and amortize such costs as costs of subscription and cost of professional services and other revenue over the estimated life of the new product or incremental functionality, which is generally two years. we also capitalize certain development costs that are attributable to developing our internally developed software platforms and amortize such costs throughout the consolidated statement of operations over the estimated life of our internally developed software platforms, which is generally five years. we focus our research and development efforts on improving our products and developing new ones, delivering new functionality and enhancing the customer experience. we believe delivering new functionality for our customers is an integral part of our solution and provides our customers with access to a broad array of options and information critical to their marketing, sales, and customer service efforts. we expect to continue to make investments in and expand our offerings to enhance our customers’ experience and satisfaction and attract new customers. over time, we expect research and development expenses to increase in absolute dollars as we continue to increase the functionality of our customer platform and remain consistent as a percentage of total revenue, exclusive of stock-based compensation expense. sales and marketing sales and marketing expenses consist primarily of personnel costs of our sales and marketing employees, including sales commissions and incentives, benefits and stock-based compensation expense, marketing programs, including lead generation, costs of our annual inbound conference, other brand building expenses, amortization of intangible assets, professional and contractor fees and allocated overhead costs. sales and marketing expenses also include commissions paid to our solutions partners in instances where the end customer purchases and pays for a subscription to our customer platform. we defer certain sales and solutions partner commissions related to acquiring new contracts and amortize them ratably over a period of benefit that we have determined to be approximately two to four years. we plan to continue to invest in sales and marketing to grow our customer base and increase sales to existing customers. this growth will include adding sales personnel and expanding our marketing activities to continue to generate leads and build brand awareness. we expect sales and marketing expenses to increase in absolute dollars as we continue to develop our sales and marketing teams. over time, we expect sales and marketing expenses will decline as a percentage of total revenue, exclusive of stock-based compensation. general and administrative general and administrative expenses consist of personnel costs and related expenses for executive, finance, legal, human resources, employee-related information technology, administrative personnel, including payroll, benefits and stock-based compensation expense, professional fees for external legal, accounting and other consulting services, and allocated overhead costs. we expect that general and administrative expenses will increase on an absolute dollar basis and remain relatively consistent as a percentage of total revenue, exclusive of stock-based compensation expense, as we focus on processes, systems and controls to enable our internal support functions to scale with the growth of our business. we also anticipate continuing increases to general and administrative expenses as we incur the costs of compliance associated with being a publicly traded company, including audit and consulting fees. restructuring restructuring expenses primarily consist primarily of lease consolidation charges and personnel costs, such as employee severance payments, benefits, and stock-based compensation expense, associated with our workforce reduction, which are described in note 17 to our consolidated financial statements included elsewhere in this annual report on form 10-k"
HUBS,"other income (expense) interest income primarily consists of interest earned on invested cash and cash equivalents balances and investments. interest expense primarily consists of amortization of the debt discount, issuance costs and contractual interest expense related to our notes, and the loss on early extinguishment of our 2022 notes. on january 1, 2022, we adopted the new guidance for convertible instruments"
HUBS,"which eliminates the recognition of the debt discount and losses on early extinguishment. in 2023 and 2022, interest expense consisted of amortization of issuance costs and contract interest expense related to our notes. other income (expense) primarily consists of the impact of foreign currency transaction gains and losses associated with monetary assets and liabilities and any gains or impairments on our strategic investments."
HUBS,"income tax expense income tax expense consists of current and deferred taxes for u.s. and foreign jurisdictions. we have a history of losses in our most significant jurisdiction, the u.s., and a full valuation allowance against the majority of our deferred tax assets."
HUBS,results of operations the following tables set forth certain consolidated financial data in dollar amounts and as a percentage of total revenue.
HUBS,"year ended december 31, 2023 2022 2021 (in thousands) revenue: subscription $2,123,479 $1,690,538 $1,258,319 professional services and other 46,751 40,431 42,339 total revenue 2,170,230 1,730,969 1,300,658 cost of revenue: subscription 290,802 257,513 211,132 professional services and other 54,687 56,746 47,725 total cost of revenue 345,489 314,259 258,857 gross profit 1,824,741 1,416,710 1,041,801 operating expenses: research and development 617,745 442,022 301,970 sales and marketing 1,068,560 886,069 649,681 general and administrative 249,649 197,720 144,949 restructuring 96,843 — — total operating expenses 2,032,797 1,525,811 1,096,600 loss from operations (208,056 ) (109,101 ) (54,799 ) other expense: interest income 58,828 15,000 1,173 interest expense (3,801 ) (3,762 ) (30,282 ) other (expense) income (4,673 ) (6,829 ) 10,090 total other income (expense) 50,354 4,409 (19,019 ) loss before income tax expense (157,702 ) (104,692 ) (73,818 ) income tax expense (18,593 ) (8,057 ) (4,019 ) net loss $(176,295 ) $(112,749 ) $(77,837 )"
HUBS,"year ended december 31, 2023 2022 2021 revenue: subscription 98 % 98 % 97 % professional services and other 2 total revenue 100 100 100 cost of revenue: subscription 13 professional services and other 3 total cost of revenue 16 18 20 gross profit 84 82 80 operating expenses: research and development 28 26 23 sales and marketing 49 51 50 general and administrative 12 11 11 restructuring 4 0 0 total operating expenses 94 88 84 loss from operations (10 ) (6 ) (4 ) total other expense 2 0 (1 ) loss before income tax expense (7 ) (6 ) (6 ) income tax expense (1 ) (0 ) (0 ) net loss -8 % -7 % -6 %"
HUBS,* percentages are based on actual values. totals may not sum due to rounding.
HUBS,"year ended december 31, 2023 compared to the year ended december 31, 2022"
HUBS,revenue
HUBS,"year ended december 31, change 2023 2022 amount % (dollars in thousands) subscription $2,123,479 $1,690,538 $432,941 26 % professional services and other 46,751 40,431 6,320 16 % total revenue $2,170,230 $1,730,969 $439,261 25 %"
HUBS,"subscription revenue increased during 2023 due to the increase in customers, which grew from 167,386 as of december 31, 2022 to 205,091 as of december 31, 2023. average subscription revenue per customer also increased from $11,163 for the year ended december 31, 2022 to $11,384 for the year ended december 31, 2023. the growth in customers was primarily driven by increased demand for our lower-priced starter products. the increase in average subscription revenue per customer was primarily driven by a continued demand for our professional and enterprise products and adoption of multiple hubs, as well as impact of foreign currency translation primarily attributable to the increase in the value of the euro and british pound sterling relative to the u.s. dollar, partially offset by continued purchases of our lower-priced starter products. professional services and other revenue increased during 2023 primarily due to an increase in overall services revenue from on-boarding and other revenue streams, including commerce hub."
HUBS,"cost of revenue, gross profit and gross margin percentage"
HUBS,"year ended december 31, change 2023 2022 amount % (dollars in thousands) total cost of revenue $345,489 $314,259 $31,230 10 % gross profit 1,824,741 1,416,710 408,031 29 % gross margin 84 % 82 %"
HUBS,"52 total cost of revenue increased during 2023 primarily due to an increase in subscription and hosting costs, amortization of capitalized software development costs, amortization of acquired technology, offset by a decrease in employee-related costs and allocated overhead expenses. the increase in gross margin was primarily driven by benefits from hosting cost efficiencies from infrastructure optimization efforts."
HUBS,"year ended december 31, change 2023 2022 amount % (dollars in thousands) subscription cost of revenue $290,802 $257,513 $33,289 % percentage of subscription revenue % %"
